### ISSUE TITLE
【不具合】PUSH配信の送信量が多い場合にWebSocketが切断されます

### ISSUE THREAD

**Issue by sakurajane** [kabucom/kabusapi#285]
■[必須] 不具合事象(概要)
   日経平均先物miniと日経平均を登録してPUSH配信を受信しています。
   3/22のアップデート後、WebSocketの切断が発生するようになりました。
   1月から同じプログラムを使用して毎日動作させていますが、3/22より前は切断事例はありません。

■[必須] 本来想定されるアクションと事象
   PUSH配信でWebSocketの切断が発生しない。

■[必須] 不備発生時刻（常時の場合は、常時で記載ください)
   配信量の多い、９時過ぎ頃に発生する場合が多いです。

■[任意] お使いの環境(OS、Excelのバージョン等)、サンプル(Macro、アドインのバージョン）
  C++のWebSocketクライアントです。

■[任意] 不備部分のログ
    kabuステのログには切断に関する記録はありませんでした。
    通信パケットを調べたところ、0.1秒間に約40以上配信が行われると、その後kabuステ側から
    強制切断されるようです。それより少ないと問題無く受信できています。
（0.1秒間に25個程度まで正常受信できている記録あり）
    複数回パケットを収集していますが、全て同じパターンです。
         以下、"**1740.7**"秒台に、45個データが送信され、最後にRSTで切断されています。
実時間では、2021/3/30 09:02:03頃からのログになります。

    No.      経過秒
  29197 1738.904109    ::1                   ::1                   TCP      64     51000 → 18080 [ACK] Seq=224 Ack=15459098 Win=529920 Len=0
  29198 1738.904593    ::1                   ::1                   TCP      1504   18080 → 51000 [ACK] Seq=15459098 Ack=224 Win=529920 Len=1440 [TCP segment of a reassembled PDU]
  29199 1738.904597    ::1                   ::1                   WebSocket 236    WebSocket Text [FIN] 
  29200 1738.904607    ::1                   ::1                   TCP      64     51000 → 18080 [ACK] Seq=224 Ack=15460710 Win=529920 Len=0
  29201 **1740.7**42559    ::1                   ::1                   TCP      1504   18080 → 51000 [ACK] Seq=15460710 Ack=224 Win=529920 Len=1440 [TCP segment of a reassembled PDU]
  29202 1740.742566    ::1                   ::1                   WebSocket 236    WebSocket Text [FIN] 
  29203 1740.742605    ::1                   ::1                   TCP      64     51000 → 18080 [ACK] Seq=224 Ack=15462322 Win=529920 Len=0
  29204 **1740.7**43026    ::1                   ::1                   TCP      1504   18080 → 51000 [ACK] Seq=15462322 Ack=224 Win=529920 Len=1440 [TCP segment of a reassembled PDU]
  29205 1740.743031    ::1                   ::1                   WebSocket 236    WebSocket Text [FIN] 
  29206 1740.743043    ::1                   ::1                   TCP      64     51000 → 18080 [ACK] Seq=224 Ack=15463934 Win=529920 Len=0
  29207 **1740.7**43476    ::1                   ::1                   TCP      1504   18080 → 51000 [ACK] Seq=15463934 Ack=224 Win=529920 Len=1440 [TCP segment of a reassembled PDU]
  29208 1740.743480    ::1                   ::1                   WebSocket 236    WebSocket Text [FIN] 
  29209 1740.743489    ::1                   ::1                   TCP      64     51000 → 18080 [ACK] Seq=224 Ack=15465546 Win=529920 Len=0
  29210 **1740.7**44165    ::1                   ::1                   TCP      1504   18080 → 51000 [ACK] Seq=15465546 Ack=224 Win=529920 Len=1440 [TCP segment of a reassembled PDU]
  29211 1740.744169    ::1                   ::1                   WebSocket 236    WebSocket Text [FIN] 
  29212 1740.744178    ::1                   ::1                   TCP      64     51000 → 18080 [ACK] Seq=224 Ack=15467158 Win=529920 Len=0
  29213 **1740.7**44487    ::1                   ::1                   TCP      1504   18080 → 51000 [ACK] Seq=15467158 Ack=224 Win=529920 Len=1440 [TCP segment of a reassembled PDU]
  29214 1740.744491    ::1                   ::1                   WebSocket 236    WebSocket Text [FIN] 
  29215 1740.744500    ::1                   ::1                   TCP      64     51000 → 18080 [ACK] Seq=224 Ack=15468770 Win=529920 Len=0
  29216 **1740.7**45077    ::1                   ::1                   TCP      1504   18080 → 51000 [ACK] Seq=15468770 Ack=224 Win=529920 Len=1440 [TCP segment of a reassembled PDU]
  29217 1740.745081    ::1                   ::1                   WebSocket 237    WebSocket Text [FIN] 
  29218 1740.745090    ::1                   ::1                   TCP      64     51000 → 18080 [ACK] Seq=224 Ack=15470383 Win=529920 Len=0
  29219 **1740.7**45397    ::1                   ::1                   TCP      1504   18080 → 51000 [ACK] Seq=15470383 Ack=224 Win=529920 Len=1440 [TCP segment of a reassembled PDU]
  29220 1740.745401    ::1                   ::1                   WebSocket 237    WebSocket Text [FIN] 
  29221 1740.745410    ::1                   ::1                   TCP      64     51000 → 18080 [ACK] Seq=224 Ack=15471996 Win=529920 Len=0
  29222 **1740.7**45913    ::1                   ::1                   TCP      1504   18080 → 51000 [ACK] Seq=15471996 Ack=224 Win=529920 Len=1440 [TCP segment of a reassembled PDU]
  29223 1740.745917    ::1                   ::1                   WebSocket 237    WebSocket Text [FIN] 
  29224 1740.745926    ::1                   ::1                   TCP      64     51000 → 18080 [ACK] Seq=224 Ack=15473609 Win=529920 Len=0
  29225 **1740.7**46394    ::1                   ::1                   TCP      1504   18080 → 51000 [ACK] Seq=15473609 Ack=224 Win=529920 Len=1440 [TCP segment of a reassembled PDU]
  29226 1740.746405    ::1                   ::1                   WebSocket 237    WebSocket Text [FIN] 
  29227 1740.746415    ::1                   ::1                   TCP      64     51000 → 18080 [ACK] Seq=224 Ack=15475222 Win=529920 Len=0
  29228 **1740.7**47003    ::1                   ::1                   TCP      1504   18080 → 51000 [ACK] Seq=15475222 Ack=224 Win=529920 Len=1440 [TCP segment of a reassembled PDU]
  29229 1740.747006    ::1                   ::1                   WebSocket 237    WebSocket Text [FIN] 
  29230 1740.747016    ::1                   ::1                   TCP      64     51000 → 18080 [ACK] Seq=224 Ack=15476835 Win=529920 Len=0
  29231 **1740.7**47379    ::1                   ::1                   TCP      1504   18080 → 51000 [ACK] Seq=15476835 Ack=224 Win=529920 Len=1440 [TCP segment of a reassembled PDU]
  29232 1740.747382    ::1                   ::1                   WebSocket 237    WebSocket Text [FIN] 
  29233 1740.747391    ::1                   ::1                   TCP      64     51000 → 18080 [ACK] Seq=224 Ack=15478448 Win=529920 Len=0
  29234 **1740.7**47714    ::1                   ::1                   TCP      1504   18080 → 51000 [ACK] Seq=15478448 Ack=224 Win=529920 Len=1440 [TCP segment of a reassembled PDU]
  29235 1740.747717    ::1                   ::1                   WebSocket 237    WebSocket Text [FIN] 
  29236 1740.747726    ::1                   ::1                   TCP      64     51000 → 18080 [ACK] Seq=224 Ack=15480061 Win=529920 Len=0
  29237 **1740.7**48066    ::1                   ::1                   TCP      1504   18080 → 51000 [ACK] Seq=15480061 Ack=224 Win=529920 Len=1440 [TCP segment of a reassembled PDU]
  29238 1740.748069    ::1                   ::1                   WebSocket 237    WebSocket Text [FIN] 
  29239 1740.748078    ::1                   ::1                   TCP      64     51000 → 18080 [ACK] Seq=224 Ack=15481674 Win=529920 Len=0
  29240 **1740.7**48417    ::1                   ::1                   TCP      1504   18080 → 51000 [ACK] Seq=15481674 Ack=224 Win=529920 Len=1440 [TCP segment of a reassembled PDU]
  29241 1740.748420    ::1                   ::1                   WebSocket 237    WebSocket Text [FIN] 
  29242 1740.748428    ::1                   ::1                   TCP      64     51000 → 18080 [ACK] Seq=224 Ack=15483287 Win=529920 Len=0
  29243 **1740.7**51183    ::1                   ::1                   TCP      1504   18080 → 51000 [ACK] Seq=15483287 Ack=224 Win=529920 Len=1440 [TCP segment of a reassembled PDU]
  29244 1740.751188    ::1                   ::1                   WebSocket 237    WebSocket Text [FIN] 
  29245 1740.751199    ::1                   ::1                   TCP      64     51000 → 18080 [ACK] Seq=224 Ack=15484900 Win=529920 Len=0
  29246 **1740.7**51830    ::1                   ::1                   TCP      1504   18080 → 51000 [ACK] Seq=15484900 Ack=224 Win=529920 Len=1440 [TCP segment of a reassembled PDU]
  29247 1740.751834    ::1                   ::1                   WebSocket 237    WebSocket Text [FIN] 
  29248 1740.751846    ::1                   ::1                   TCP      64     51000 → 18080 [ACK] Seq=224 Ack=15486513 Win=529920 Len=0
  29249 **1740.7**52241    ::1                   ::1                   TCP      1504   18080 → 51000 [ACK] Seq=15486513 Ack=224 Win=529920 Len=1440 [TCP segment of a reassembled PDU]
  29250 1740.752245    ::1                   ::1                   WebSocket 237    WebSocket Text [FIN] 
  29251 1740.752253    ::1                   ::1                   TCP      64     51000 → 18080 [ACK] Seq=224 Ack=15488126 Win=529920 Len=0
  29252 **1740.7**52755    ::1                   ::1                   TCP      1504   18080 → 51000 [ACK] Seq=15488126 Ack=224 Win=529920 Len=1440 [TCP segment of a reassembled PDU]
  29253 1740.752765    ::1                   ::1                   WebSocket 237    WebSocket Text [FIN] 
  29254 1740.752775    ::1                   ::1                   TCP      64     51000 → 18080 [ACK] Seq=224 Ack=15489739 Win=529920 Len=0
  29255 **1740.7**53084    ::1                   ::1                   TCP      1504   18080 → 51000 [ACK] Seq=15489739 Ack=224 Win=529920 Len=1440 [TCP segment of a reassembled PDU]
  29256 1740.753088    ::1                   ::1                   WebSocket 237    WebSocket Text [FIN] 
  29257 1740.753096    ::1                   ::1                   TCP      64     51000 → 18080 [ACK] Seq=224 Ack=15491352 Win=529920 Len=0
  29258 **1740.7**53762    ::1                   ::1                   TCP      1504   18080 → 51000 [ACK] Seq=15491352 Ack=224 Win=529920 Len=1440 [TCP segment of a reassembled PDU]
  29259 1740.753765    ::1                   ::1                   WebSocket 237    WebSocket Text [FIN] 
  29260 1740.753774    ::1                   ::1                   TCP      64     51000 → 18080 [ACK] Seq=224 Ack=15492965 Win=529920 Len=0
  29261 **1740.7**54078    ::1                   ::1                   TCP      1504   18080 → 51000 [ACK] Seq=15492965 Ack=224 Win=529920 Len=1440 [TCP segment of a reassembled PDU]
  29262 1740.754082    ::1                   ::1                   WebSocket 237    WebSocket Text [FIN] 
  29263 1740.754091    ::1                   ::1                   TCP      64     51000 → 18080 [ACK] Seq=224 Ack=15494578 Win=529920 Len=0
  29264 **1740.7**54398    ::1                   ::1                   TCP      1504   18080 → 51000 [ACK] Seq=15494578 Ack=224 Win=529920 Len=1440 [TCP segment of a reassembled PDU]
  29265 1740.754402    ::1                   ::1                   WebSocket 237    WebSocket Text [FIN] 
  29266 1740.754411    ::1                   ::1                   TCP      64     51000 → 18080 [ACK] Seq=224 Ack=15496191 Win=529920 Len=0
  29267 **1740.7**54900    ::1                   ::1                   TCP      1504   18080 → 51000 [ACK] Seq=15496191 Ack=224 Win=529920 Len=1440 [TCP segment of a reassembled PDU]
  29268 1740.754903    ::1                   ::1                   WebSocket 237    WebSocket Text [FIN] 
  29269 1740.754912    ::1                   ::1                   TCP      64     51000 → 18080 [ACK] Seq=224 Ack=15497804 Win=529920 Len=0
  29270 **1740.7**55217    ::1                   ::1                   TCP      1504   18080 → 51000 [ACK] Seq=15497804 Ack=224 Win=529920 Len=1440 [TCP segment of a reassembled PDU]
  29271 1740.755220    ::1                   ::1                   WebSocket 237    WebSocket Text [FIN] 
  29272 1740.755229    ::1                   ::1                   TCP      64     51000 → 18080 [ACK] Seq=224 Ack=15499417 Win=529920 Len=0
  29273 **1740.7**55562    ::1                   ::1                   TCP      1504   18080 → 51000 [ACK] Seq=15499417 Ack=224 Win=529920 Len=1440 [TCP segment of a reassembled PDU]
  29274 1740.755565    ::1                   ::1                   WebSocket 237    WebSocket Text [FIN] 
  29275 1740.755583    ::1                   ::1                   TCP      64     51000 → 18080 [ACK] Seq=224 Ack=15501030 Win=529920 Len=0
  29276 **1740.7**56082    ::1                   ::1                   TCP      1504   18080 → 51000 [ACK] Seq=15501030 Ack=224 Win=529920 Len=1440 [TCP segment of a reassembled PDU]
  29277 1740.756085    ::1                   ::1                   WebSocket 237    WebSocket Text [FIN] 
  29278 1740.756095    ::1                   ::1                   TCP      64     51000 → 18080 [ACK] Seq=224 Ack=15502643 Win=529920 Len=0
  29279 **1740.7**56404    ::1                   ::1                   TCP      1504   18080 → 51000 [ACK] Seq=15502643 Ack=224 Win=529920 Len=1440 [TCP segment of a reassembled PDU]
  29280 1740.756415    ::1                   ::1                   WebSocket 237    WebSocket Text [FIN] 
  29281 1740.756424    ::1                   ::1                   TCP      64     51000 → 18080 [ACK] Seq=224 Ack=15504256 Win=529920 Len=0
  29282 **1740.7**56798    ::1                   ::1                   TCP      1504   18080 → 51000 [ACK] Seq=15504256 Ack=224 Win=529920 Len=1440 [TCP segment of a reassembled PDU]
  29283 1740.756801    ::1                   ::1                   WebSocket 237    WebSocket Text [FIN] 
  29284 1740.756810    ::1                   ::1                   TCP      64     51000 → 18080 [ACK] Seq=224 Ack=15505869 Win=529920 Len=0
  29285 **1740.7**57286    ::1                   ::1                   TCP      1504   18080 → 51000 [ACK] Seq=15505869 Ack=224 Win=529920 Len=1440 [TCP segment of a reassembled PDU]
  29286 1740.757290    ::1                   ::1                   WebSocket 237    WebSocket Text [FIN] 
  29287 1740.757299    ::1                   ::1                   TCP      64     51000 → 18080 [ACK] Seq=224 Ack=15507482 Win=529920 Len=0
  29288 **1740.7**57657    ::1                   ::1                   TCP      1504   18080 → 51000 [ACK] Seq=15507482 Ack=224 Win=529920 Len=1440 [TCP segment of a reassembled PDU]
  29289 1740.757660    ::1                   ::1                   WebSocket 237    WebSocket Text [FIN] 
  29290 1740.757669    ::1                   ::1                   TCP      64     51000 → 18080 [ACK] Seq=224 Ack=15509095 Win=529920 Len=0
  29291 **1740.7**57984    ::1                   ::1                   TCP      1504   18080 → 51000 [ACK] Seq=15509095 Ack=224 Win=529920 Len=1440 [TCP segment of a reassembled PDU]
  29292 1740.757987    ::1                   ::1                   WebSocket 237    WebSocket Text [FIN] 
  29293 1740.757996    ::1                   ::1                   TCP      64     51000 → 18080 [ACK] Seq=224 Ack=15510708 Win=529920 Len=0
  29294 **1740.7**58489    ::1                   ::1                   TCP      1504   18080 → 51000 [ACK] Seq=15510708 Ack=224 Win=529920 Len=1440 [TCP segment of a reassembled PDU]
  29295 1740.758492    ::1                   ::1                   WebSocket 237    WebSocket Text [FIN] 
  29296 1740.758501    ::1                   ::1                   TCP      64     51000 → 18080 [ACK] Seq=224 Ack=15512321 Win=529920 Len=0
  29297 **1740.7**58876    ::1                   ::1                   TCP      1504   18080 → 51000 [ACK] Seq=15512321 Ack=224 Win=529920 Len=1440 [TCP segment of a reassembled PDU]
  29298 1740.758880    ::1                   ::1                   WebSocket 237    WebSocket Text [FIN] 
  29299 1740.758889    ::1                   ::1                   TCP      64     51000 → 18080 [ACK] Seq=224 Ack=15513934 Win=529920 Len=0
  29300 **1740.7**59204    ::1                   ::1                   TCP      1504   18080 → 51000 [ACK] Seq=15513934 Ack=224 Win=529920 Len=1440 [TCP segment of a reassembled PDU]
  29301 1740.759207    ::1                   ::1                   WebSocket 237    WebSocket Text [FIN] 
  29302 1740.759216    ::1                   ::1                   TCP      64     51000 → 18080 [ACK] Seq=224 Ack=15515547 Win=529920 Len=0
  29303 **1740.7**59549    ::1                   ::1                   TCP      1504   18080 → 51000 [ACK] Seq=15515547 Ack=224 Win=529920 Len=1440 [TCP segment of a reassembled PDU]
  29304 1740.759553    ::1                   ::1                   WebSocket 237    WebSocket Text [FIN] 
  29305 1740.759562    ::1                   ::1                   TCP      64     51000 → 18080 [ACK] Seq=224 Ack=15517160 Win=529920 Len=0
  29306 **1740.7**59946    ::1                   ::1                   TCP      1504   18080 → 51000 [ACK] Seq=15517160 Ack=224 Win=529920 Len=1440 [TCP segment of a reassembled PDU]
  29307 1740.759957    ::1                   ::1                   WebSocket 237    WebSocket Text [FIN] 
  29308 1740.759967    ::1                   ::1                   TCP      64     51000 → 18080 [ACK] Seq=224 Ack=15518773 Win=529920 Len=0
  29309 **1740.7**74415    ::1                   ::1                   TCP      1504   18080 → 51000 [ACK] Seq=15518773 Ack=224 Win=529920 Len=1440 [TCP segment of a reassembled PDU]
  29310 1740.774420    ::1                   ::1                   WebSocket 239    WebSocket Text [FIN] 
  29311 1740.774431    ::1                   ::1                   TCP      64     51000 → 18080 [ACK] Seq=224 Ack=15520388 Win=529920 Len=0
  29312 **1740.7**74849    ::1                   ::1                   TCP      1504   18080 → 51000 [ACK] Seq=15520388 Ack=224 Win=529920 Len=1440 [TCP segment of a reassembled PDU]
  29313 1740.774854    ::1                   ::1                   WebSocket 239    WebSocket Text [FIN] 
  29314 1740.774866    ::1                   ::1                   TCP      64     51000 → 18080 [ACK] Seq=224 Ack=15522003 Win=529920 Len=0
  29315 **1740.7**75264    ::1                   ::1                   TCP      1504   18080 → 51000 [ACK] Seq=15522003 Ack=224 Win=529920 Len=1440 [TCP segment of a reassembled PDU]
  29316 1740.775269    ::1                   ::1                   WebSocket 239    WebSocket Text [FIN] 
  29317 1740.775280    ::1                   ::1                   TCP      64     51000 → 18080 [ACK] Seq=224 Ack=15523618 Win=529920 Len=0
  29318 **1740.7**75663    ::1                   ::1                   TCP      1504   18080 → 51000 [ACK] Seq=15523618 Ack=224 Win=529920 Len=1440 [TCP segment of a reassembled PDU]
  29319 1740.775666    ::1                   ::1                   WebSocket 239    WebSocket Text [FIN] 
  29320 1740.775675    ::1                   ::1                   TCP      64     51000 → 18080 [ACK] Seq=224 Ack=15525233 Win=529920 Len=0
  29321 **1740.7**76005    ::1                   ::1                   TCP      1504   18080 → 51000 [ACK] Seq=15525233 Ack=224 Win=529920 Len=1440 [TCP segment of a reassembled PDU]
  29322 1740.776009    ::1                   ::1                   WebSocket 239    WebSocket Text [FIN] 
  29323 1740.776018    ::1                   ::1                   TCP      64     51000 → 18080 [ACK] Seq=224 Ack=15526848 Win=529920 Len=0
  29324 **1740.7**76550    ::1                   ::1                   TCP      1504   18080 → 51000 [ACK] Seq=15526848 Ack=224 Win=529920 Len=1440 [TCP segment of a reassembled PDU]
  29325 1740.776553    ::1                   ::1                   WebSocket 237    WebSocket Text [FIN] 
  29326 1740.776562    ::1                   ::1                   TCP      64     51000 → 18080 [ACK] Seq=224 Ack=15528461 Win=529920 Len=0
  29327 **1740.7**76887    ::1                   ::1                   TCP      1504   18080 → 51000 [ACK] Seq=15528461 Ack=224 Win=529920 Len=1440 [TCP segment of a reassembled PDU]
  29328 1740.776891    ::1                   ::1                   WebSocket 237    WebSocket Text [FIN] 
  29329 1740.776900    ::1                   ::1                   TCP      64     51000 → 18080 [ACK] Seq=224 Ack=15530074 Win=529920 Len=0
  29330 **1740.7**77241    ::1                   ::1                   TCP      1504   18080 → 51000 [ACK] Seq=15530074 Ack=224 Win=529920 Len=1440 [TCP segment of a reassembled PDU]
  29331 1740.777245    ::1                   ::1                   WebSocket 237    WebSocket Text [FIN] 
  29332 1740.777253    ::1                   ::1                   TCP      64     51000 → 18080 [ACK] Seq=224 Ack=15531687 Win=529920 Len=0
  29333 **1740.7**77670    ::1                   ::1                   TCP      1504   18080 → 51000 [ACK] Seq=15531687 Ack=224 Win=529920 Len=1440 [TCP segment of a reassembled PDU]
  29334 1740.777682    ::1                   ::1                   WebSocket 237    WebSocket Text [FIN] 
  29335 1740.777691    ::1                   ::1                   TCP      64     51000 → 18080 [ACK] Seq=224 Ack=15533300 Win=529920 Len=0
  29336 1740.778633    ::1                   ::1                   TCP      64     18080 → 51000 [**_RST_**, ACK] Seq=15533300 Ack=224 Win=0 Len=0

**Comment by yasuyuki-nakazawa** [comment]
#284  と合わせて調査しております。
ご不便をおかけして恐縮ですが、今しばらくお待ちくださいませ

**Comment by sakurajane** [comment]
動作環境について補足します。
・OS：Windows Server 2012（VM環境）
・クライアント：C++自作（websocketライブラリは、boostのbeastライブラリを使用）
＃284との類似性は、VM環境でWindows Serverを使用していること？

よろしくお願いします。

**Comment by sakurajane** [comment]
現在の発生状況ですが、毎日発生するわけではないですが、９時過ぎのデータ更新が多い場合に発生することが多いです。
現状、日経平均先物mini／TOPIX先物mini／DOW先物を登録しています。

**Comment by sakurajane** [comment]
自分の推測では、.Net FrameworkのWebSocketは非同期送信にタスクを使用しており、タスクは
以下のように遅延要因があるため、送信リクエストやその他のタスクが集中するとWebSocketの
送信途中（外部に出る前）にタイムアウトするのが原因ではと思いました。
（アプリの構造はわからないのであくまで推測です）
https://oita.oika.me/2016/02/18/task-and-threadpool/

また、3/22のアップデート後に発生するようになった点に関しては、何らかの改善（ドロップ防止など）の
ため上記のタスク処理が若干処理が重くなり、自分の環境で発生するようになったという推測もあります。

しかし、恐らくkabuステの処理に明確な不具合は無く、現状のkabuステの作りでは動作環境の
処理能力不足が大きな要因とも思えるので、動作環境の変更で対応予定です。

Windows ServerはクライアントOSと違いCPUが空いている状態でも一つのアプリケーションに
優先的にCPUを割り当てないようですので、Windows Serverで動かしているのも一つの要因だと思っています。

対応ありがとうございました。
#284をウォッチしていきます。

**Comment by sakurajane** [comment]
一つ前のコメントの補足をします。

問題が発生した際のパケットキャプチャが複数あり、全て以下のパターンでしたので、
前回のコメントのような推測をしました。

---------------------------------------------------------
(1)正常に通信
(2)2～3秒間無通信
(3)0.1～0.2秒の間に大量の通信（40以上）があり、その最後は
   kabuステからの切断（RST）。
---------------------------------------------------------

当初は(3)のみに注目していて、大量にデータを送信する際にバッファ枯渇のような
状態になっているのではと思いました。

改めて(1)～(3)の流れを見てみると、(2)の無通信の間に溜まったデータが
(3)で一気に吐き出されているように思えてきました。

(2)の部分では処理の輻輳が起きており送信が停止し、さらには通信が正常が
出来ていないと判定され切断要求が出され、その切断要求自体も送信バッファの
最後に追加されているため、(3)で通信が再開した際に一気にデータと切断要求が
流れているように見えました。
